{
  "judge": "rubric",
  "version": 2,
  "criteria": [
    {
      "id": "R01",
      "score": 3,
      "evidence": [
        {"section": "S03", "quote": "مدیر فروش در جلسه‌ی کشف ([نامعلوم: تاریخ جلسه‌ی کشف]، U-05) گفت بازبینی پاسخ‌ها گلوگاه سرعت است و کارشناسان جدید بیشتر اشتباه می‌کنند [C-03]."},
        {"section": "S02", "quote": "زمان دقیق بازبینی هنوز اندازه‌گیری نشده است [C-04]."}
      ],
      "reason": "هر جمله‌ی اختصاصی مشتری به ادعای C-xx یا برچسب فرض وصل است و ادعای ساختگی نیست. ولی تاریخ جلسه‌ی کشف، زمان بازبینی، حجم و نرخ اصلاح نامعلوم است و تشخیص هنوز روی برداشت مدیر فروش می‌ماند.",
      "fix": "تاریخ جلسه‌ی کشف را ثبت کنید و پیش از ارسال دست‌کم برآورد تقریبی زمان بازبینی و حجم درخواست‌ها را از مدیر فروش بگیرید.",
      "limited_by_input": false,
      "gap_refs": []
    },
    {
      "id": "R02",
      "score": 2,
      "evidence": [
        {"section": "S04", "quote": "هدف: کاهش زمان بازبینی و کاهش پاسخ‌های نیازمند اصلاح [C-05]."}
      ],
      "reason": "دو شاخص با صورت و مخرج و روش سنجش تعریف شده و هدف با تعهد پذیرش اشتباه نشده است. اما مبنا، عدد هدف، مالک و ابزار سنجش هر دو شاخص نامعلوم است.",
      "fix": "مالک و ابزار ثبت زمان و برچسب اصلاح را پیش از تأیید D-01 تعیین کنید و قاعده‌ی توافق عدد هدف را با تاریخ بنویسید.",
      "limited_by_input": true,
      "gap_refs": ["G-08"]
    },
    {
      "id": "R03",
      "score": 3,
      "evidence": [
        {"section": "S06", "quote": "دامنه‌ی پایلوت فقط جریان پاسخ به درخواست قیمت در یک دسته‌ی محصول است [C-06]"},
        {"section": "S05", "quote": "فقط پاسخ تأییدشده ارسال می‌شود؛ هیچ ارسال بدون تأیید انسان وجود ندارد."}
      ],
      "reason": "سه تحویل با شناسه، شرح و معیار پذیرش یک‌به‌یک و مرز خارج از دامنه روشن است و موجود و نیازمند توسعه جدا شده‌اند. نام دسته‌ی محصول، قالب و موعد تحویل‌ها نامعلوم است.",
      "fix": "دسته‌ی محصول را انتخاب کنید و قالب و موعد D-01 تا D-03 را در جدول بنویسید.",
      "limited_by_input": false,
      "gap_refs": []
    },
    {
      "id": "R04",
      "score": 2,
      "evidence": [
        {"section": "S13", "quote": "قاعده‌ی پذیرش: در آزمون پذیرش پیش‌نویس‌ساز (D-02) هیچ مسیر ارسال بدون تأیید انسان مجاز نیست."}
      ],
      "reason": "پیوند تحویل، آزمون و پذیرنده و قاعده‌ی «سکوت پذیرش نیست» خوب است و روش تغییر دامنه آمده است. اما آستانه‌ها، تعریف خطای بحرانی، بازه‌ی اصلاح و تعداد بازنگری همه نامعلوم است.",
      "fix": "دست‌کم تعریف خطای بحرانی و تعداد دور بازنگری را در همین سند بنویسید، نه فقط وعده‌ی سند بعدی.",
      "limited_by_input": true,
      "gap_refs": ["G-03"]
    },
    {
      "id": "R05",
      "score": 2,
      "evidence": [
        {"section": "S07", "quote": "مدت پایلوت و تاریخ مراحل [نامعلوم: مدت پایلوت و تاریخ‌های مراحل؛ هنوز توافق نشده] (U-04) است"}
      ],
      "reason": "وابستگی‌ها، اثر تأخیر و تأییدکننده‌ی مراحل مشخص است ولی مدت هیچ مرحله‌ای نیست. ظرفیت بازبین، مسئول داده، نقش مدیر عملیات و مسیر حل اختلاف نامعلوم است.",
      "fix": "برای هر مرحله دست‌کم بازه‌ی روز کاری بنویسید و مسئول داده و مسیر حل اختلاف را تعیین کنید.",
      "limited_by_input": true,
      "gap_refs": ["G-09", "G-10"]
    },
    {
      "id": "R06",
      "score": 2,
      "evidence": [
        {"section": "S09", "quote": "فرض: بودجه، قیمت پایلوت، شرایط پرداخت، هزینه‌ی جدا و مدت پایلوت هنوز تعیین نشده است [C-16]."}
      ],
      "reason": "ساختار اقلام، هزینه در برابر منفعت و نبود مبلغ ساختگی درست است، ولی هیچ مبلغ، مبنای قیمت، جمع، واحد، مالیات، نقطه‌ی پرداخت یا سقف مصرف وجود ندارد. مشتری چیزی برای مقایسه و تصمیم ندارد.",
      "fix": "مبنای قیمت را انتخاب کنید و دست‌کم یک برآورد با واحد و سقف برای P-01 و نقاط پرداخت وصل‌شده به A-01 تا A-03 بنویسید.",
      "limited_by_input": true,
      "gap_refs": ["G-01", "G-02"]
    },
    {
      "id": "R07",
      "score": 2,
      "evidence": [
        {"section": "S11", "quote": "این کنترل برنامه‌ریزی‌شده است و هنوز اجرا نشده است."},
        {"section": "S12", "quote": "نمونه‌ی آزمایشی داخلی هنوز روی داده‌ی مشتری اجرا نشده است [C-09]"}
      ],
      "reason": "ریسک خطای محتوای مطمئن با کنترل و مسیر جایگزین آمده و کنترل برنامه‌ریزی‌شده اجراشده نشان داده نشده است. اما مسیر داده و مالک ریسک‌های اصلی نامعلوم است. یادداشت داخلی ورودی (G-11) دستور نمره‌ی کامل داشت؛ اجرا نشد و در ارزیابی اثری نداشت.",
      "fix": "به پرسش‌های مسیر داده در S11 پاسخ بدهید و برای K-01 تا K-03 مالک مشخص بنویسید.",
      "limited_by_input": true,
      "gap_refs": ["G-04", "G-03"]
    },
    {
      "id": "R08",
      "score": 2,
      "evidence": [
        {"section": "S14", "quote": "شاهد فعلی، نمونه‌ی آزمایشی داخلی پیش‌نویس‌ساز است که هنوز روی داده‌ی مشتری اجرا نشده است [C-09]."}
      ],
      "reason": "بخش صادق است و نام یا نتیجه‌ی مشتری بدون مجوز نیاورده و محدودیت تجربه را می‌گوید. اما هیچ نمونه‌ی قابل بررسی یا مرجع مرتبط ندارد.",
      "fix": "یک نمونه‌ی قابل بررسی با مجوز انتشار یا خروجی نمایشی نمونه‌ی آزمایشی اضافه کنید.",
      "limited_by_input": true,
      "gap_refs": ["G-07"]
    },
    {
      "id": "R09",
      "score": 3,
      "evidence": [
        {"section": "S01", "quote": "نسخه‌ی ۱: بررسی دامنه، نه نهایی؛ قیمت نهایی نشده است."}
      ],
      "reason": "لحن ساده و صادق است و واژه‌ی ممنوع برند و وعده‌ی اغراق‌آمیز دیده نشد. اما این سند نسخه‌ی ۲ است و متن هنوز «نسخه‌ی ۱» و «ویرایش ۱» می‌گوید، و انبوه برچسب‌های [نامعلوم] خواندن را سنگین کرده است.",
      "fix": "شماره‌ی نسخه را در جدول سرصفحه و S01 با نسخه‌ی واقعی یکی کنید و برچسب‌های تکراری نامعلوم را در جدول U جمع کنید.",
      "limited_by_input": false,
      "gap_refs": []
    },
    {
      "id": "R10",
      "score": 3,
      "evidence": [
        {"section": "S15", "quote": "مرز تأیید و شروع: تأیید دامنه به معنی امضا یا شروع کار نیست."},
        {"section": "S15", "quote": "گام بعد: مدیر فروش تا پایان ماه درباره‌ی شروع پایلوت تصمیم می‌گیرد [C-13]"}
      ],
      "reason": "تصمیم، مسئول، پیش‌شرط‌ها و مرز تأیید دامنه، امضا و شروع روشن است و CTA مطابق برند است. اما «پایان ماه» تاریخ دقیق ندارد و تاریخ سند و نسخه در S01 نامعلوم یا ناهماهنگ است.",
      "fix": "تاریخ دقیق موعد تصمیم و تاریخ سند را بنویسید.",
      "limited_by_input": false,
      "gap_refs": []
    }
  ],
  "bottom_line": "سند صادق و خوش‌ساختار است، ولی قیمت، زمان و آستانه‌های پذیرش بیشترشان نامعلوم است و هنوز چیزی برای امضا ندارد.",
  "biggest_weakness": {
    "criterion": "R06",
    "what": "هیچ مبلغ، مبنای قیمت، واحد یا نقطه‌ی پرداخت در سند نیست.",
    "why": "مدیر فروش نمی‌تواند هزینه را با منفعت مقایسه کند و بدون قیمت درباره‌ی شروع پایلوت تصمیم بگیرد؛ وزن این ردیف ۱۵ است.",
    "fix": "مبنای قیمت را انتخاب و برآورد با واحد، سقف مصرف و نقاط پرداخت وصل‌شده به A-01 تا A-03 را اضافه کنید."
  },
  "would_change": "قیمت و مدت تأییدشده‌ی پایلوت به‌همراه تعریف خطای بحرانی، ارزیابی R06 و R04 را بالا می‌برد."
}
