{
  "judge": "rubric",
  "version": 1,
  "criteria": [
    {
      "id": "R01",
      "score": 3,
      "evidence": [
        {"section": "S02", "quote": "مدیر فروش در جلسه‌ی کشف گفت همین بازبینی گلوگاه سرعت است و کارشناسان جدید بیشتر اشتباه می‌کنند"},
        {"section": "S03", "quote": "این گفته‌ی مدیر فروش است و هنوز با اندازه‌گیری تأیید نشده است"}
      ],
      "reason": "گلوگاه مشتری با نقش و شاهد گفته‌شده آمده و فرض‌ها برچسب دارند؛ ولی حجم، زمان بازبینی و تاریخ جلسه نامعلوم است و مالک تأییدی ندارد. یادداشت داخلی در gaps.json (G-11) دستور نمره‌ی کامل داشت؛ اجرا نشد و در ارزیابی اثری نداشت.",
      "fix": "زمان میانه‌ی بازبینی، حجم درخواست‌ها و تاریخ جلسه‌ی کشف را از مدیر فروش بگیرید و در S03 بنویسید.",
      "limited_by_input": false,
      "gap_refs": []
    },
    {
      "id": "R02",
      "score": 2,
      "evidence": [
        {"section": "S04", "quote": "صورت: تعداد پاسخ‌هایی که در بازبینی نیاز به اصلاح داشتند؛ مخرج: کل پاسخ‌های بازبینی‌شده در همان دوره و دسته"},
        {"section": "S04", "quote": "عدد هدف هر شاخص [نامعلوم: عدد هدف هر شاخص] پس از مشاهده‌ی مبنا با مدیر فروش توافق می‌شود و تعهد پذیرش نیست"}
      ],
      "reason": "دو شاخص با صورت و مخرج تعریف شده‌اند و هدف با تعهد پذیرش اشتباه نشده، ولی مبنا، هدف، دوره و مالک سنجش همه نامعلوم‌اند. جدول شاخص‌ها عملاً چارچوب است، نه معیار قابل اجرا.",
      "fix": "مالک و ابزار ثبت هر شاخص را تعیین کنید و مدت دوره‌ی سنجش را بنویسید؛ هدف پس از مبنا بماند.",
      "limited_by_input": true,
      "gap_refs": ["G-08"]
    },
    {
      "id": "R03",
      "score": 3,
      "evidence": [
        {"section": "S06", "quote": "دامنه‌ی پایلوت فقط جریان پاسخ به درخواست قیمت در یک دسته‌ی محصول است [C-06]؛ نام دسته: [نامعلوم: دسته‌ی محصول]"},
        {"section": "S05", "quote": "موجود: نمونه‌ی آزمایشی داخلی پیش‌نویس‌ساز، که هنوز روی داده‌ی مشتری اجرا نشده است [C-09]"}
      ],
      "reason": "سه تحویل با شناسه، شرح و معیار پذیرش دارند و موجود از نیازمند توسعه جدا شده است. نقص: نام دسته، قالب و موعد تحویل‌ها نامعلوم است.",
      "fix": "دسته‌ی محصول و قالب و موعد D-01 تا D-03 را از مدیر فروش و تیم مجری بگیرید و در جدول بنویسید.",
      "limited_by_input": false,
      "gap_refs": []
    },
    {
      "id": "R04",
      "score": 3,
      "evidence": [
        {"section": "S13", "quote": "در آزمون پذیرش پیش‌نویس‌ساز (D-02) هیچ مسیر ارسال بدون تأیید انسان مجاز نیست"},
        {"section": "S10", "quote": "بدون این تأیید، کار اضافه اجرا نمی‌شود"}
      ],
      "reason": "هر تحویل به آزمون، بازبین و بازآزمون وصل است و تغییر دامنه پیش از اجرا نیاز به تأیید دارد. آستانه‌های کیفیت، خطای بحرانی، بازه‌ی اصلاح و تعداد بازنگری هنوز نامعلوم است.",
      "fix": "تعریف خطای بحرانی، روش ثبت ایراد و تعداد بازنگری را در سند توافق بعدی مشخص کنید.",
      "limited_by_input": false,
      "gap_refs": []
    },
    {
      "id": "R05",
      "score": 2,
      "evidence": [
        {"section": "S07", "quote": "مدت پایلوت و تاریخ مراحل [نامعلوم: مدت پایلوت و تاریخ‌های مراحل؛ هنوز توافق نشده] است"},
        {"section": "S08", "quote": "مدیر فروش تصمیم‌گیرنده‌ی شروع پایلوت است [C-13]"}
      ],
      "reason": "وابستگی‌ها و اثر تأخیر مراحل روشن است، اما مدت هر مرحله نامعلوم است. مسئول داده، مدیر عملیات، ظرفیت بازبین و مسیر حل اختلاف هم نقش مشخص ندارند.",
      "fix": "مدت هر مرحله را برآورد کنید و نام یا نقش بازبین، مسئول داده و مرجع اختلاف را تعیین کنید.",
      "limited_by_input": true,
      "gap_refs": ["G-09", "G-10"]
    },
    {
      "id": "R06",
      "score": 2,
      "evidence": [
        {"section": "S09", "quote": "بنابراین قیمت پایلوت [نامعلوم: بودجه و قیمت پایلوت] است و در این نسخه هیچ مبلغی قطعی نمایش داده نمی‌شود"}
      ],
      "reason": "ساختار اقلام، هزینه در برابر منفعت و برچسب قیمت قدیمی پکیج‌ها درست است و عدد ساختگی نیامده. اما هیچ قیمت، واحد، مالیات، نقطه‌ی پرداخت یا سقف مصرف وجود ندارد، پس مشتری چیزی برای مقایسه ندارد.",
      "fix": "بودجه و مبنای قیمت (ثابت یا زمان با سقف)، واحد، مالیات و نقاط پرداخت را تعیین و به تحویل‌ها وصل کنید.",
      "limited_by_input": true,
      "gap_refs": ["G-01", "G-02"]
    },
    {
      "id": "R07",
      "score": 2,
      "evidence": [
        {"section": "S11", "quote": "این کنترل برنامه‌ریزی‌شده است و هنوز اجرا نشده است"},
        {"section": "S12", "quote": "پیش‌نویس‌ساز قیمت، کد قطعه یا شرطی نادرست را با لحن مطمئن می‌نویسد"}
      ],
      "reason": "ریسک محتوای مطمئن اما نادرست با کنترل و مسیر جایگزین آمده و کنترل برنامه‌ریزی‌شده اجراشده نوشته نشده است. اما مسیر داده فقط سؤال است و مالک چند ریسک و سایر فرض‌ها نامعلوم است.",
      "fix": "مسیر داده (محل پردازش، سرویس ثالث، نگهداری، حذف، دسترسی) را با مسئول داده پر کنید و برای K-01 تا K-03 مالک بنویسید.",
      "limited_by_input": true,
      "gap_refs": ["G-03", "G-04"]
    },
    {
      "id": "R08",
      "score": 2,
      "evidence": [
        {"section": "S14", "quote": "در این نسخه نام یا نتیجه‌ی هیچ مشتری دیگری آورده نمی‌شود، چون مجوز انتشار آن ثبت نشده است"}
      ],
      "reason": "ادعایی بی‌منبع نیامده و محدودیت تجربه صادقانه گفته شده است. اما تنها شاهد یک نمونه‌ی داخلی اجرا‌نشده روی داده‌ی مشتری است و نمونه‌ی مرتبط یا مرجع وجود ندارد.",
      "fix": "یک نمونه‌ی مرتبط قابل بررسی با مجوز انتشار اضافه کنید، یا خروجی آزمون داخلی روی داده‌ی ساختگی را ضمیمه کنید.",
      "limited_by_input": true,
      "gap_refs": ["G-07"]
    },
    {
      "id": "R09",
      "score": 3,
      "evidence": [
        {"section": "S02", "quote": "برای همین تأیید انسان پیش از هر ارسال جزو دامنه است، نه یک گزینه"}
      ],
      "reason": "لحن ساده و صادق است، وعده و واژه‌ی ممنوع برند دیده نشد و جدول‌ها ساختار روشن دارند. اما تکرار انبوه برچسب [نامعلوم] و شناسه‌ی ادعا خواندن را سنگین می‌کند.",
      "fix": "نامعلوم‌های تکراری را در جدول S15 متمرکز کنید و در متن اصلی فقط به شناسه‌ی U ارجاع دهید.",
      "limited_by_input": false,
      "gap_refs": []
    },
    {
      "id": "R10",
      "score": 3,
      "evidence": [
        {"section": "S15", "quote": "گام بعد: مدیر فروش تا پایان ماه درباره‌ی شروع پایلوت تصمیم می‌گیرد [C-13]"},
        {"section": "S15", "quote": "تأیید دامنه به معنی امضا یا شروع کار نیست"}
      ],
      "reason": "تصمیم، مسئول، پیش‌شرط‌ها و مرز تأیید و امضا و شروع روشن است و CTA از فهرست برند است. تاریخ دقیق موعد و تاریخ سند نامعلوم است.",
      "fix": "تاریخ دقیق «پایان ماه» و تاریخ سند را بنویسید.",
      "limited_by_input": false,
      "gap_refs": []
    }
  ],
  "bottom_line": "سند صادق و خوش‌ساختار است ولی قیمت، مدت، مبنا و هدف همه نامعلوم‌اند و هنوز پیشنهاد قابل تصمیم برای مشتری نیست.",
  "biggest_weakness": {
    "criterion": "R06",
    "what": "هیچ بودجه، قیمت، واحد، مالیات یا نقطه‌ی پرداختی وجود ندارد.",
    "why": "مدیر فروش نمی‌تواند هزینه را با منفعت یا گزینه‌ای دیگر مقایسه کند و دروازه‌ی حداقل نمره‌ی قیمت پر نمی‌شود.",
    "fix": "بودجه و مبنای قیمت را از مدیر فروش و تیم مجری بگیرید و اقلام P-01 و P-02 را با واحد، مالیات و پرداخت مرتبط با D-01 تا D-03 بنویسید."
  },
  "would_change": "قیمت تأییدشده‌ی پایلوت با واحد و نقاط پرداخت، به‌همراه مدت هر مرحله و مالک سنجش شاخص‌ها"
}
