{
  "judge": "rubric",
  "version": 1,
  "criteria": [
    {
      "id": "R01",
      "score": 3,
      "evidence": [
        {"section": "S02", "quote": "مدیر فروش در جلسه‌ی کشف گفت این بازبینی گلوگاه پاسخ‌گویی است"},
        {"section": "S03", "quote": "زمان میانه‌ی این بازبینی هنوز اندازه‌گیری نشده است"}
      ],
      "reason": "مسئله‌ی اختصاصی مشتری به ادعاهای C-01 و C-02 وصل است و نامعلوم‌ها صادقانه برچسب خورده‌اند. اما حجم پیش‌نویس‌ها، تعداد کارشناسان و اثر گلوگاه هیچ‌جا نیامده و شاهد فقط یک جلسه است.",
      "fix": "در S03 حجم تقریبی پیش‌نویس‌ها و تعداد بازبین‌ها را با منبع بنویسید یا صریح نامعلوم اعلام کنید.",
      "limited_by_input": false,
      "gap_refs": []
    },
    {
      "id": "R02",
      "score": 3,
      "evidence": [
        {"section": "S04", "quote": "هدف عددی هر شاخص پس از مشاهده‌ی خط مبنا با مالک فروش توافق می‌شود و تا آن زمان تعهد پذیرش نیست."}
      ],
      "reason": "هر دو شاخص فرمول، روش سنجش و مالک دارند و هدف با تعهد پذیرش اشتباه نشده است. خط مبنا و هدف هر دو باز مانده‌اند، پس هنوز نتیجه‌ی سنجیدنی نهایی نیست و مالک آن را تأیید نکرده.",
      "fix": "پیش از نهایی‌شدن، مالک فروش شاخص‌ها و فرمول‌ها را کتبی تأیید کند و بازه‌ی زمانی توافق هدف را بنویسید.",
      "limited_by_input": false,
      "gap_refs": []
    },
    {
      "id": "R03",
      "score": 3,
      "evidence": [
        {"section": "S06", "quote": "دامنه‌ی پایلوت: یک کانال (ایمیل)، حداکثر ۳ کاربر فروش و مجموعه‌ی آزمون توافق‌شده."}
      ],
      "reason": "دامنه قابل شمارش است، سه تحویل شناسه، قالب، موعد و معیار پذیرش دارند و موارد خارج از دامنه فهرست شده‌اند. اندازه‌ی مجموعه‌ی آزمون مشخص نیست و بخش راه‌حل گزینه‌های بررسی‌شده را نشان نمی‌دهد.",
      "fix": "تعداد نمونه‌های مجموعه‌ی آزمون را در D-01 بنویسید و در S05 یک جمله درباره‌ی گزینه‌ی ردشده اضافه کنید.",
      "limited_by_input": false,
      "gap_refs": []
    },
    {
      "id": "R04",
      "score": 3,
      "evidence": [
        {"section": "S13", "quote": "در آزمون پذیرش، هیچ مسیر ارسال بدون تأیید انسانی مجاز نیست؛ سایر آستانه‌های کیفیت با داده‌ی پایلوت توافق می‌شوند."}
      ],
      "reason": "هر تحویل آزمون، بازبین، مهلت اصلاح و بازآزمون دارد و مسیر تغییر دامنه با تأیید کتبی در S10 تعریف شده است. آستانه‌ی کیفیت A-02 باز است و A-03 ستون داده و خطای بحرانی خالی دارد.",
      "fix": "برای A-03 خطای بحرانی و داده‌ی سناریو را تعریف کنید و تاریخ توافق آستانه‌ی A-02 را بنویسید.",
      "limited_by_input": false,
      "gap_refs": []
    },
    {
      "id": "R05",
      "score": 3,
      "evidence": [
        {"section": "S07", "quote": "ارزیابی فقط پس از تثبیت مجموعه‌ی آزمون و دسترسی آزمایشی آغاز می‌شود؛ تأخیر در این دو مورد برنامه را جابه‌جا می‌کند."}
      ],
      "reason": "پیش‌نیاز، مدت، تأییدکننده و اثر تأخیر مشخص است و جمع ۱۰ و ۱۵ و ۵ با موعدهای D-01 تا D-03 می‌خواند. مسیر اختلاف و مشورت‌دهنده‌ها نیامده و T-03 در جدول نقش‌ها ردیف پاسخ ندارد.",
      "fix": "یک سطر مسیر ارجاع اختلاف اضافه کنید و برای آموزش و تحویل، زمان پاسخ مسئول عملیات فروش را بنویسید.",
      "limited_by_input": false,
      "gap_refs": []
    },
    {
      "id": "R06",
      "score": 3,
      "evidence": [
        {"section": "S09", "quote": "هزینه‌ی API جدا محاسبه می‌شود؛ سقف مصرف و اقدام هنگام رسیدن به سقف پیش از شروع توافق می‌شود."}
      ],
      "reason": "اقلام ۶۰ و ۹۰ میلیون جمعشان ۱۵۰ میلیون است، درصد پرداخت‌ها ۱۰۰ است، مالیات و هزینه‌ی جدا روشن است و مبلغ نامعلوم قطعی نشده. اما سقف API عددی ندارد و PAY-01 پیش از نهایی‌شدن قیمت وصول می‌شود.",
      "fix": "سقف مصرف API را عددی کنید و مشخص کنید PAY-01 روی کدام قیمت نهایی محاسبه می‌شود.",
      "limited_by_input": false,
      "gap_refs": []
    },
    {
      "id": "R07",
      "score": 3,
      "evidence": [
        {"section": "S11", "quote": "این کنترل‌ها برنامه‌ریزی‌شده‌اند و هنوز اجرا نشده‌اند."}
      ],
      "reason": "کنترل برنامه‌ریزی‌شده به‌عنوان اجراشده نوشته نشده، مسئول تصمیم داده مشخص است و دو ریسک اصلی مالک و مسیر جایگزین دارند. محل پردازش و نام پردازشگر، رخداد امنیتی و احتمال ریسک‌ها گفته نشده است.",
      "fix": "در S11 دسته‌ی داده و پردازشگر (پس از تأیید U-01) و مسیر گزارش رخداد را بنویسید و به ریسک‌ها احتمال بدهید.",
      "limited_by_input": false,
      "gap_refs": []
    },
    {
      "id": "R08",
      "score": 2,
      "evidence": [
        {"section": "S14", "quote": "نتایج تجاری مشتریان قبلی در این سند ادعا نمی‌شود."}
      ],
      "reason": "بخش صادق است و ادعایی بی‌منبع ندارد، اما نمونه‌ی نمایش‌داده‌شده نام و شرح ندارد و هیچ مسئول یا سابقه‌ی مرتبطی معرفی نشده است. مالک نمونه را تأیید نکرده و محدودیت تجربه هم نوشته نشده.",
      "fix": "نمونه را با نام و شرح خروجی مشخص کنید، تیم مجری و نقش‌ها را بنویسید و محدودیت تجربه را صریح اعلام کنید.",
      "limited_by_input": false,
      "gap_refs": []
    },
    {
      "id": "R09",
      "score": 3,
      "evidence": [
        {"section": "S02", "quote": "منفعت اصلی، ظرفیت آزادشده‌ی تیم در بازبینی پیش‌نویس‌هاست"}
      ],
      "reason": "سند RTL، جدول‌محور و بدون واژه‌ی ممنوع برند یا عدد بی‌منبع است و لحن صادق و بدون اغراق است. لحن اداری‌تر از صدای همکار برند است و خلاصه‌ی اجرایی پشتیبانی اختیاری را بدون برچسب در هزینه‌ی ماهانه می‌آورد.",
      "fix": "در S02 کلمه‌ی «اختیاری» را کنار پشتیبانی ماهانه بیفزایید و جمله‌های طولانی را کوتاه کنید.",
      "limited_by_input": false,
      "gap_refs": []
    },
    {
      "id": "R10",
      "score": 3,
      "evidence": [
        {"section": "S15", "quote": "گام بعد، تأیید دامنه‌ی پایلوت و تعیین مسئول داده توسط مدیر فروش تا ۱۴۰۵/۰۷/۱۴ است"}
      ],
      "reason": "گام بعد دارای تصمیم، نقش و موعد است و مرز تأیید دامنه، توافق و شروع کار جدا شده است. موعد ۱۴۰۵/۰۷/۱۴ با مشتری تأیید نشده و در سند فقط پیشنهاد است.",
      "fix": "موعد تأیید دامنه را با مدیر فروش هماهنگ کنید و تأیید او را در وضعیت سند ثبت کنید.",
      "limited_by_input": false,
      "gap_refs": []
    }
  ],
  "bottom_line": "سند از نظر ساختار و صداقت قوی و همه‌ی ردیف‌ها پر است، اما هیچ بخشی تأیید مالک را ندارد و بخش توان اجرا عملاً خالی از شاهد قابل بررسی است.",
  "biggest_weakness": {
    "criterion": "R08",
    "what": "نمونه‌ی مرتبط بدون نام و شرح آمده و تیم یا سابقه‌ای معرفی نشده است.",
    "why": "خواننده نمی‌تواند توان اجرا را بسنجد و ادعا فقط به یک جمله‌ی بی‌جزئیات متکی است.",
    "fix": "نمونه را نام ببرید و خروجی آن را شرح دهید، تیم مجری را معرفی کنید و محدودیت تجربه را بنویسید."
  },
  "would_change": "تأیید کتبی مدیر فروش برای شاخص‌ها و دامنه، و معرفی مشخص نمونه‌ی نمایش‌داده‌شده با نام و شرح، نمره‌ی چند ردیف را به ۴ می‌رساند."
}
