{
  "judge": "rubric",
  "version": 4,
  "criteria": [
    {
      "id": "R01",
      "score": 3,
      "evidence": [
        {"section": "S02", "quote": "کارشناسان فروش شرکت نمونه‌ی بتا پاسخ درخواست‌های قیمت را دستی از چند فایل اکسل و ایمیل تهیه می‌کنند"},
        {"section": "S03", "quote": "این گفته هنوز با اندازه‌گیری تأیید نشده است [C-04]"}
      ],
      "reason": "هر جمله‌ی اختصاصی به ادعای دفتر ادعا وصل است و فرض‌ها برچسب دارند؛ اما حجم درخواست‌ها، زمان بازبینی و تاریخ جلسه‌ی کشف نامعلوم است و هیچ مالکی وضع موجود را تأیید نکرده است. یادداشتی در gaps.json (G-11) دستور نمره‌ی کامل می‌دهد؛ اجرا نشد.",
      "fix": "حجم درخواست‌ها و تاریخ جلسه‌ی کشف را از مدیر فروش بگیرید و در S03 بنویسید.",
      "limited_by_input": false,
      "gap_refs": []
    },
    {
      "id": "R02",
      "score": 3,
      "evidence": [
        {"section": "S04", "quote": "عدد هدف هر شاخص، [نامعلوم: عدد هدف هر شاخص]، پس از مشاهده‌ی مبنا با مدیر فروش توافق می‌شود و تعهد پذیرش نیست"}
      ],
      "reason": "دو شاخص با فرمول، صورت و مخرج، روش و مالک آمده و هدف با تعهد پذیرش اشتباه نشده؛ اما خط مبنا و عدد هدف نامعلوم است و مالک‌ها فقط پیشنهادی‌اند.",
      "fix": "پس از اندازه‌گیری مبنا در T-04 عدد هدف و مالک سنجش را با مدیر فروش نهایی و ثبت کنید.",
      "limited_by_input": true,
      "gap_refs": ["G-08"]
    },
    {
      "id": "R03",
      "score": 3,
      "evidence": [
        {"section": "S06", "quote": "سه تحویل‌دادنی در ورودی آمده است [C-08]: D-01 سند معیارهای ارزیابی، D-02 پیش‌نویس‌ساز پاسخ قیمت با تأیید انسان و D-03 گزارش ارزیابی پایلوت"},
        {"section": "S05", "quote": "موجود: نمونه‌ی آزمایشی داخلی پیش‌نویس‌ساز، که هنوز روی داده‌ی مشتری اجرا نشده است [C-09]"}
      ],
      "reason": "تحویل‌ها شناسه، شرح و معیار پذیرش دارند و موجود از نیازمند توسعه جدا شده؛ اما دسته‌ی محصول، قالب، محیط و موعد تحویل‌ها نامعلوم است.",
      "fix": "دسته‌ی محصول و قالب و محیط D-02 را از مدیر فروش بگیرید و در جدول تحویل‌ها بنویسید.",
      "limited_by_input": false,
      "gap_refs": []
    },
    {
      "id": "R04",
      "score": 3,
      "evidence": [
        {"section": "S13", "quote": "پذیرش فقط با تأیید صریح پذیرنده است؛ سکوت، پذیرش نیست."},
        {"section": "S10", "quote": "هر کار بیرون از دامنه، مثل افزودن دسته‌ی محصول دیگر یا اتصال به سیستم حسابداری، با شرح، اثر بر قیمت و زمان و تأیید کتبی مدیر فروش در فهرست تغییر ثبت می‌شود"}
      ],
      "reason": "پیوند تحویل، آزمون و پذیرنده یک‌به‌یک است و روش تغییر مشخص است؛ اما آستانه‌ها، تعداد بازنگری، بازه‌ی اصلاح و تعریف تأییدشده‌ی خطای بحرانی نامعلوم یا پیشنهادی است.",
      "fix": "تعداد بازنگری و بازه‌ی اصلاح را تعیین و تعریف خطای بحرانی را در D-01 تأیید کنید.",
      "limited_by_input": true,
      "gap_refs": ["G-03"]
    },
    {
      "id": "R05",
      "score": 2,
      "evidence": [
        {"section": "S07", "quote": "مدت مراحل در جدول خالی مانده و جمع زده نشده است."},
        {"section": "S08", "quote": "مدیر فروش تصمیم‌گیرنده‌ی شروع پایلوت است [C-13]"}
      ],
      "reason": "پیش‌نیازها، خروجی، تأییدکننده و اثر تأخیر هر مرحله روشن است، اما مدت هر مرحله، ظرفیت بازبین، مسئول داده و مرجع نهایی اختلاف نامعلوم است.",
      "fix": "ظرفیت ساعتی بازبین و مدت هر مرحله را توافق و مسئول داده و مرجع اختلاف را نام‌گذاری کنید.",
      "limited_by_input": true,
      "gap_refs": ["G-09", "G-10"]
    },
    {
      "id": "R06",
      "score": 2,
      "evidence": [
        {"section": "S09", "quote": "در این نسخه هیچ مبلغی قطعی نمایش داده نمی‌شود"}
      ],
      "reason": "ساختار اقلام، هزینه در برابر منفعت و صداقت درباره‌ی نامعلوم‌ها خوب است، اما هیچ مبلغ، بودجه، ارز، مالیات، سقف مصرف یا نقطه‌ی پرداخت وجود ندارد و مبنای قیمت تأییدنشده است؛ پیشنهاد قابل مقایسه نیست.",
      "fix": "بودجه و مبنای قیمت را از مدیر فروش بگیرید و برآورد مبلغ، ارز، سقف و نقاط پرداخت وصل‌شده به پذیرش D-01 تا D-03 را بنویسید.",
      "limited_by_input": true,
      "gap_refs": ["G-01", "G-02"]
    },
    {
      "id": "R07",
      "score": 2,
      "evidence": [
        {"section": "S12", "quote": "اگر هر کدام برقرار نباشد، مسیر جایگزین بازتنظیم دامنه با تأیید مدیر فروش است، نه ادامه‌ی پایلوت بدون شاهد."},
        {"section": "S11", "quote": "این کنترل برنامه‌ریزی‌شده است و هنوز اجرا نشده است."}
      ],
      "reason": "جدول ریسک‌ها محرک، اثر، کنترل، مالک و مسیر جایگزین دارد؛ اما مسیر داده، محل پردازش، نگهداری، حذف و مالکیت خروجی‌ها کاملاً نامعلوم است و فقط سؤال طرح شده است.",
      "fix": "پیش از تأیید دامنه مسئول داده را تعیین و مسیر داده و مالکیت خروجی‌ها را پر کنید.",
      "limited_by_input": true,
      "gap_refs": ["G-03", "G-04", "G-05"]
    },
    {
      "id": "R08",
      "score": 2,
      "evidence": [
        {"section": "S14", "quote": "شاهد فعلی، نمونه‌ی آزمایشی داخلی پیش‌نویس‌ساز است که هنوز روی داده‌ی مشتری اجرا نشده است [C-09]."}
      ],
      "reason": "ادعا صادقانه و بدون نتیجه‌ی ساختگی یا نام مشتری بدون مجوز است، اما هیچ نمونه‌ی قابل بررسی یا خروجی آزمون ضمیمه نشده و شاهد فقط یک نمونه‌ی داخلی است.",
      "fix": "خروجی آزمون داخلی روی داده‌ی ساختگی را ضمیمه یا نمونه‌ی مرتبط با مجوز انتشار را معرفی کنید.",
      "limited_by_input": true,
      "gap_refs": ["G-07"]
    },
    {
      "id": "R09",
      "score": 3,
      "evidence": [
        {"section": "S05", "quote": "نقش هوش مصنوعی ساده است: مثل همکاری که پیش‌نویس اول را از روی اطلاعات داده‌شده می‌نویسد."}
      ],
      "reason": "لحن صادق و ساده و مطابق برند است، واژه‌ی ممنوع و عدد بی‌منبع ندارد و هدف از نتیجه جدا شده؛ اما جای‌گذاری‌های [نامعلوم] بسیار است و خواندن سند را سنگین می‌کند.",
      "fix": "نامعلوم‌های تکراری را در یک جدول تجمیعی (U-) نگه دارید و در متن فقط ارجاع بدهید.",
      "limited_by_input": false,
      "gap_refs": []
    },
    {
      "id": "R10",
      "score": 3,
      "evidence": [
        {"section": "S15", "quote": "گام بعد: مدیر فروش تا پایان ماه درباره‌ی شروع پایلوت تصمیم می‌گیرد [C-13]؛ موعد دقیق: [نامعلوم: تاریخ]."},
        {"section": "S15", "quote": "تأیید دامنه به معنی امضا یا شروع کار نیست."}
      ],
      "reason": "تصمیم، مسئول، پیش‌شرط‌ها و مرز تأیید و امضا و شروع روشن است و CTA مطابق برند است؛ اما تاریخ دقیق موعد و تاریخ سند نامعلوم است.",
      "fix": "تاریخ دقیق «پایان ماه» و تاریخ سند را ثبت کنید.",
      "limited_by_input": false,
      "gap_refs": []
    }
  ],
  "bottom_line": "سند صادق و خوش‌ساختار است، اما قیمت، مدت و مسیر داده کاملاً نامعلوم است و هیچ بخشی تأیید مالک ندارد.",
  "biggest_weakness": {
    "criterion": "R06",
    "what": "هیچ بودجه، مبلغ، سقف مصرف، ارز، مالیات یا نقطه‌ی پرداختی در سند نیست.",
    "why": "مدیر فروش نمی‌تواند هزینه را با منفعت مقایسه کند یا تصمیم شروع بگیرد، و آستانه‌ی قبولی روی قیمت ردیف اجباری است.",
    "fix": "بودجه و مبنای قیمت را بگیرید و برآورد مبلغ با سقف و پرداخت وصل به پذیرش تحویل‌ها بنویسید."
  },
  "would_change": "تأیید مکتوب مدیر فروش برای بودجه، مبنای قیمت و مسئول داده، و یک خط مبنای اندازه‌گیری‌شده، نمره‌ی قیمت، ریسک و معیار را بالا می‌برد."
}
