{
  "judge": "rubric",
  "version": 1,
  "criteria": [
    {
      "id": "R01",
      "score": 3,
      "evidence": [
        {"section": "S02", "quote": "مدیر فروش در جلسه‌ی کشف گفت این بازبینی گلوگاه پاسخ‌گویی است [C-01]."},
        {"section": "S03", "quote": "زمان میانه‌ی این بازبینی هنوز اندازه‌گیری نشده است و ایجاد خط مبنای آن جزو تحویل فاز کشف است."}
      ],
      "reason": "مسئله به دو ادعای واقعی جلسه‌ی کشف وصل است و نامعلوم‌ها صریح برچسب خورده‌اند. اما حجم پیش‌نویس‌ها، تعداد کارشناسان بازبین و اثر تأخیر بر مشتری نیامده و هیچ شاهدی نشان نمی‌دهد مالک فروش این تشخیص را تأیید کرده است.",
      "fix": "در S03 حجم تقریبی پیش‌نویس‌ها و تعداد بازبین‌ها را از صورت‌جلسه بیاورید، یا صریحاً نامعلوم بنویسید و در پیوست نامعلوم‌ها ثبت کنید.",
      "limited_by_input": false,
      "gap_refs": []
    },
    {
      "id": "R02",
      "score": 3,
      "evidence": [
        {"section": "S04", "quote": "هدف عددی هر شاخص پس از مشاهده‌ی خط مبنا با مالک فروش توافق می‌شود و تا آن زمان تعهد پذیرش نیست."}
      ],
      "reason": "دو شاخص با فرمول، روش سنجش و مالک تعریف شده و هدف با تعهد پذیرش خلط نشده است. خط مبنا و هدف هر دو باز است، «دوره‌ی پایلوت» تنها دوره‌ی سنجش است و حجم نمونه‌ی لازم برای میانه معلوم نیست.",
      "fix": "حداقل تعداد پیش‌نویس برای محاسبه‌ی میانه و موعد توافق هدف (مثلاً پایان T-01) را در جدول شاخص‌ها اضافه کنید.",
      "limited_by_input": false,
      "gap_refs": []
    },
    {
      "id": "R03",
      "score": 3,
      "evidence": [
        {"section": "S06", "quote": "دامنه‌ی پایلوت: یک کانال (ایمیل)، حداکثر ۳ کاربر فروش و مجموعه‌ی آزمون توافق‌شده."},
        {"section": "S05", "quote": "برای کاهش زمان بازبینی، پیش‌نویس کنار شواهد سرنخ نمایش داده می‌شود تا کارشناس بتواند مبنای پیام را بررسی کند."}
      ],
      "reason": "دامنه قابل شمارش است، سه تحویل شناسه و معیار پذیرش دارند و موارد خارج از دامنه فهرست شده‌اند. ولی جریان «پیش‌نویس کنار شواهد» که هسته‌ی راه‌حل است در هیچ تحویلی نیست، تعداد نمونه‌های مجموعه‌ی آزمون نیامده و موجود در برابر نیازمند توسعه در S05 جدا نشده است.",
      "fix": "تعداد نمونه‌های مجموعه‌ی آزمون را در D-01 بنویسید، جریان بازبینی پیکربندی‌شده را تحویل یا زیرشرح D-02 کنید و در S05 موجود و نیازمند توسعه را جدا کنید.",
      "limited_by_input": false,
      "gap_refs": []
    },
    {
      "id": "R04",
      "score": 3,
      "evidence": [
        {"section": "S13", "quote": "در آزمون پذیرش، هیچ مسیر ارسال بدون تأیید انسانی مجاز نیست؛ سایر آستانه‌های کیفیت با داده‌ی پایلوت توافق می‌شوند."},
        {"section": "S10", "quote": "هر تغییر دامنه با ثبت اثر بر قیمت و زمان و تأیید کتبی مدیر فروش پیش از اجرا انجام می‌شود."}
      ],
      "reason": "هر تحویل یک‌به‌یک به آزمون، بازبین، خطای بحرانی، مهلت اصلاح و بازآزمون وصل است و تغییر دامنه تأییدکننده‌ی مشخص دارد. آستانه‌های کیفی A-02 هنوز باز است و رفتار در صورت بی‌پاسخی مشتری و تعداد دورهای اصلاح تعریف نشده است.",
      "fix": "در S13 بنویسید اگر مدیر فروش در مهلت بازبینی پاسخ ندهد چه می‌شود و حداکثر چند دور اصلاح و بازآزمون در قیمت گنجانده شده است.",
      "limited_by_input": false,
      "gap_refs": []
    },
    {
      "id": "R05",
      "score": 3,
      "evidence": [
        {"section": "S07", "quote": "ارزیابی فقط پس از تثبیت مجموعه‌ی آزمون و دسترسی آزمایشی آغاز می‌شود؛ تأخیر در این دو مورد برنامه را جابه‌جا می‌کند."},
        {"section": "S08", "quote": "برچسب درست/نادرست مجموعه‌ی آزمون"}
      ],
      "reason": "مسیر وابستگی، مدت، خروجی، تأییدکننده و اثر تأخیر روشن است و ۱۰+۱۵+۵ برابر ۳۰ روز کاری است. اما مهلت‌های اصلاح A-01 و A-02 (۳ و ۵ روز) و زمان پاسخ‌های ۲ تا ۳ روزه در مدت مراحل حساب نشده‌اند و مسیر اختلاف و نقش مشورتی نیامده است.",
      "fix": "در جدول T-01 تا T-03 مشخص کنید مهلت اصلاح پذیرش و زمان پاسخ تأییدکننده داخل مدت مرحله است یا اضافه بر آن، و یک مسیر ارجاع اختلاف بنویسید.",
      "limited_by_input": false,
      "gap_refs": []
    },
    {
      "id": "R06",
      "score": 3,
      "evidence": [
        {"section": "S09", "quote": "مبالغ بدون مالیات بر ارزش افزوده است؛ مالیات طبق قانون جدا محاسبه می‌شود."},
        {"section": "S09", "quote": "سقف مصرف API پیش از شروع توافق می‌شود؛ هنگام رسیدن به ۸۰٪ سقف به مشتری اطلاع داده می‌شود."}
      ],
      "reason": "اقلام و جمع یک‌باره (۶۰+۹۰=۱۵۰ میلیون) و ۴۰٪+۶۰٪ می‌خوانند، مالیات و هزینه‌ی API جدا شده و مبلغ نامعلوم قطعی نشان داده نشده است. ولی برای P-03 رویداد پرداخت تعریف نشده و D-03 به پرداختی وصل نیست، قیمت‌ها با وجود وضعیت «قیمت پس از تأیید دامنه نهایی می‌شود» عدد قطعی‌نما دارند و سقف API هنوز عدد ندارد.",
      "fix": "رویداد و زمان پرداخت P-03 را بنویسید، وضعیت عددی بودن P-01 و P-02 را در برابر «قیمت نهایی نشده» روشن کنید و سقف API را تا موعد U-01 عدد بگذارید.",
      "limited_by_input": false,
      "gap_refs": []
    },
    {
      "id": "R07",
      "score": 3,
      "evidence": [
        {"section": "S11", "quote": "این کنترل‌ها برنامه‌ریزی‌شده‌اند و هنوز اجرا نشده‌اند."},
        {"section": "S12", "quote": "بازبینی انسانی پیش از هر ارسال و ثبت خطا"},
        {"section": "S10", "quote": "اتصال CRM خارج از پایلوت است؛ پس از بررسی API، دامنه و هزینه جدا پیشنهاد می‌شود."}
      ],
      "reason": "کنترل برنامه‌ریزی‌شده به‌عنوان اجراشده نوشته نشده، ریسک ادعای نادرست مالک و مسیر جایگزین دارد و فرض دسترسی صریح است. مسیر داده ناقص است: پردازشگر مدل و محل پردازش نام برده نشده، رخداد امنیتی پوشش ندارد و فقط دو ریسک ثبت شده که ریسک تأخیر برچسب‌گذاری و احتمال/اثر ندارند.",
      "fix": "در S11 دسته‌ی داده، پردازشگر و روش اطلاع‌رسانی رخداد را بنویسید و در S12 ریسک تأخیر مجموعه‌ی آزمون و ستون احتمال/اثر را اضافه کنید.",
      "limited_by_input": false,
      "gap_refs": []
    },
    {
      "id": "R08",
      "score": 2,
      "evidence": [
        {"section": "S14", "quote": "نتایج تجاری مشتریان قبلی در این سند ادعا نمی‌شود."},
        {"section": "S14", "quote": "نمونه‌ی قابل بررسی در جلسه‌ی کشف نمایش داده شد [C-03]."}
      ],
      "reason": "ادعایی بی‌منبع نیست و نتیجه‌ی مشتری قبلی هم ادعا نشده، اما بخش فقط دو جمله است: نمونه معرفی نشده، تیم و تجربه‌ی مرتبط و محدودیت تجربه هیچ‌کدام نیامده است.",
      "fix": "نمونه‌ی نمایش‌داده‌شده را نام ببرید، تجربه‌ی قابل‌پیگیری تیم مجری در همین نوع کار را با ادعای دفتر ادعا بنویسید و محدودیت آن را ذکر کنید.",
      "limited_by_input": false,
      "gap_refs": []
    },
    {
      "id": "R09",
      "score": 3,
      "evidence": [
        {"section": "S04", "quote": "موفقیت پیش از اجرا تعریف می‌شود."},
        {"section": "S09", "quote": "ظرفیت آزادشده صرفه‌جویی نقدی نیست، مگر هزینه‌ای واقعاً حذف شود."}
      ],
      "reason": "لحن ساده، صادق و بی‌وعده است و واژه‌ی ممنوع برند دیده نشد؛ ساختار ۱۵ بخش با شناسه‌ی سطر ثابت است. نقص: جدول‌های ۸ و ۹ ستونی (S04، S13) برای خواندن و دسترس‌پذیری سنگین‌اند و بند اصلی هزینه و منفعت در S02 و S09 تکرار می‌شود.",
      "fix": "جدول‌های شاخص و پذیرش را به دو جدول باریک‌تر بشکنید یا ستون‌های کم‌کاربرد را به پیوست ببرید و تکرار هزینه و منفعت را در S02 کوتاه کنید.",
      "limited_by_input": false,
      "gap_refs": []
    },
    {
      "id": "R10",
      "score": 3,
      "evidence": [
        {"section": "S15", "quote": "گام بعد، تأیید دامنه‌ی پایلوت و تعیین مسئول داده توسط مدیر فروش تا ۱۴۰۵/۰۷/۱۴ است"},
        {"section": "S01", "quote": "اعتبار قیمت تا ۱۴۰۵/۰۸/۰۷."}
      ],
      "reason": "تصمیم، مسئول، موعد و پیش‌شرط شروع (دامنه، دسترسی آزمایشی، توافق مکتوب) روشن است و وضعیت پیش‌نویس درست اعلام شده. ولی امضاکننده‌ی توافق، سند بعدی و رابطه‌ی موعد ۰۷/۱۴ با پرداخت PAY-01 مشخص نیست و دستور یا RFP مشتری‌ای که انطباق با آن سنجیده شود در سند نیست.",
      "fix": "در S15 امضاکننده‌ی توافق و سند بعدی (قیمت و برنامه‌ی نهایی) را نام ببرید و بنویسید امضا در چه ترتیبی با PAY-01 و شروع کار قرار دارد.",
      "limited_by_input": false,
      "gap_refs": []
    }
  ],
  "bottom_line": "سند صادق و خوب مستند است ولی هسته‌ی راه‌حل تحویل مشخصی ندارد و هیچ ردیفی هنوز تأیید مالک را ندارد، پس سقف نمره ۳ است.",
  "biggest_weakness": {
    "criterion": "R03",
    "what": "جریان «پیش‌نویس کنار شواهد سرنخ» که راه‌حل اصلی است در هیچ‌یک از D-01 تا D-03 به‌عنوان خروجی نیامده و تعداد نمونه‌های مجموعه‌ی آزمون نامعلوم است.",
    "why": "مشتری ۹۰ میلیون تومان برای پیکربندی و ارزیابی می‌پردازد، ولی D-02 فقط گزارش است و D-03 آموزش جریانی است که تحویل آن تعریف نشده؛ پذیرش و اختلاف بعدی هم مبنای قابل شمارش ندارد.",
    "fix": "جریان بازبینی پیکربندی‌شده را با محیط و تعداد کاربر، و تعداد نمونه‌های مجموعه‌ی آزمون را در D-01 و D-02 بنویسید."
  },
  "would_change": "تأیید مکتوب مدیر فروش بر مسئله‌ی S03 و اهداف S04، و تعداد نمونه‌ی آزمون با تعریف روشن جریان تحویلی، نمره‌های R01 تا R03 را به ۴ نزدیک می‌کرد."
}
