{
  "judge": "rubric",
  "version": 3,
  "criteria": [
    {
      "id": "R01",
      "score": 3,
      "evidence": [
        {"section": "S03", "quote": "این گفته هنوز با اندازه‌گیری تأیید نشده است [C-04]."},
        {"section": "S02", "quote": "زمان دقیق بازبینی هنوز اندازه‌گیری نشده است [C-04]."}
      ],
      "reason": "تشخیص به جلسه‌ی کشف و دفتر ادعا وصل است و ادعای اندازه‌گیری‌نشده درست برچسب خورده. ولی حجم درخواست‌ها، نرخ اصلاح و تاریخ جلسه نامعلوم است و تشخیص هنوز کمّی نیست.",
      "fix": "حجم درخواست‌ها و نرخ اصلاح فعلی را از مدیر فروش بگیرید و در بخش تشخیص بنویسید.",
      "limited_by_input": false,
      "gap_refs": []
    },
    {
      "id": "R02",
      "score": 3,
      "evidence": [
        {"section": "S04", "quote": "عدد هدف هر شاخص [نامعلوم: عدد هدف هر شاخص] (U-03) پس از مشاهده‌ی مبنا با مدیر فروش توافق می‌شود و تعهد پذیرش نیست."}
      ],
      "reason": "دو شاخص با صورت، مخرج، روش و مالک تعریف شده‌اند و هدف با تعهد پذیرش قاطی نشده. مبنا و هدف عددی نیست و مالک سنجش هنوز فقط پیشنهادی است.",
      "fix": "مالک و ابزار ثبت را در جلسه‌ی تأیید دامنه (U-07) از مدیر فروش تأیید بگیرید.",
      "limited_by_input": true,
      "gap_refs": ["G-08"]
    },
    {
      "id": "R03",
      "score": 3,
      "evidence": [
        {"section": "S06", "quote": "دامنه‌ی پایلوت فقط جریان پاسخ به درخواست قیمت در یک دسته‌ی محصول است [C-06]"},
        {"section": "S05", "quote": "پیش‌نویس‌ساز از منابع مجاز یک پیش‌نویس پاسخ می‌سازد و منبع هر بخش را کنار آن نشان می‌دهد."}
      ],
      "reason": "سه تحویل شمارش‌پذیر با شناسه و معیار پذیرش دارند و موجود و نیازمند توسعه جدا شده‌اند. نام دسته‌ی محصول، قالب و موعد هر تحویل نامعلوم است.",
      "fix": "دسته‌ی محصول را انتخاب و قالب و موعد D-01 تا D-03 را در سند قیمت و برنامه ثابت کنید.",
      "limited_by_input": true,
      "gap_refs": ["G-10"]
    },
    {
      "id": "R04",
      "score": 3,
      "evidence": [
        {"section": "S13", "quote": "قاعده‌ی پذیرش: در آزمون پذیرش پیش‌نویس‌ساز (D-02) هیچ مسیر ارسال بدون تأیید انسان مجاز نیست."},
        {"section": "S10", "quote": "بدون این تأیید، کار اضافه اجرا نمی‌شود."}
      ],
      "reason": "هر تحویل آزمون، بازبین و بازآزمون دارد و تغییر دامنه به تأیید کتبی وابسته است. آستانه‌های کیفیت، بازه‌ی اصلاح و تعداد بازنگری نامعلوم و همه‌ی روش‌ها پیشنهادی‌اند.",
      "fix": "تعریف بازنگری و تعداد آن (U-17) و بازه‌ی اصلاح ایراد (U-21) را با مدیر فروش نهایی کنید.",
      "limited_by_input": true,
      "gap_refs": ["G-03"]
    },
    {
      "id": "R05",
      "score": 2,
      "evidence": [
        {"section": "S07", "quote": "مدت پایلوت و تاریخ مراحل [نامعلوم: مدت پایلوت و تاریخ‌های مراحل؛ هنوز توافق نشده] (U-04) است"},
        {"section": "S08", "quote": "مدیر فروش تصمیم‌گیرنده‌ی شروع پایلوت است [C-13]"}
      ],
      "reason": "وابستگی‌ها، تأییدکننده‌ها و اثر تأخیر هر مرحله روشن است، اما مدت همه‌ی مراحل و ظرفیت بازبین نامعلوم است. مسئول داده، مرجع اختلاف و نقش مدیر عملیات هم تعیین نشده.",
      "fix": "ظرفیت ساعتی بازبین و مسئول داده را تعیین کنید و مدت هر مرحله را برآورد کنید.",
      "limited_by_input": true,
      "gap_refs": ["G-09", "G-10"]
    },
    {
      "id": "R06",
      "score": 2,
      "evidence": [
        {"section": "S09", "quote": "بنابراین قیمت پایلوت [نامعلوم: بودجه و قیمت پایلوت] (U-02) است و در این نسخه هیچ مبلغی قطعی نمایش داده نمی‌شود."}
      ],
      "reason": "ساختار اقلام و هزینه در برابر منفعت درست است و مبلغ نامعلوم قطعی نشده، ولی هیچ مبلغ، مبنا، واحد، مالیات یا نقطه‌ی پرداختی وجود ندارد. مشتری چیزی برای مقایسه ندارد.",
      "fix": "یک بازه‌ی برآوردی یا مبنای محاسبه (قیمت ثابت یا زمان با سقف) و نقاط پرداخت وصل‌شده به D-01 تا D-03 تعیین و مالک تأیید کند.",
      "limited_by_input": true,
      "gap_refs": ["G-01", "G-02"]
    },
    {
      "id": "R07",
      "score": 2,
      "evidence": [
        {"section": "S11", "quote": "این کنترل برنامه‌ریزی‌شده است و هنوز اجرا نشده است."},
        {"section": "S12", "quote": "نمونه‌ی آزمایشی داخلی هنوز روی داده‌ی مشتری اجرا نشده است [C-09]"}
      ],
      "reason": "جدول ریسک قوی است (محرک، کنترل، مالک، مسیر جایگزین) و کنترل برنامه‌ریزی‌شده اجراشده جا زده نشده. اما مسیر داده در امنیت فقط فهرست سؤال است و مالک‌های ریسک و فرض‌های دیگر تأییدنشده‌اند.",
      "fix": "مسئول داده‌ی مشتری را تعیین کنید تا محل پردازش، نگهداری، حذف و مسیر رخداد پیش از شروع پاسخ داده شود.",
      "limited_by_input": true,
      "gap_refs": ["G-03", "G-04"]
    },
    {
      "id": "R08",
      "score": 2,
      "evidence": [
        {"section": "S14", "quote": "شاهد فعلی، نمونه‌ی آزمایشی داخلی پیش‌نویس‌ساز است که هنوز روی داده‌ی مشتری اجرا نشده است [C-09]."}
      ],
      "reason": "ادعا صادقانه و محدودیت تجربه گفته شده و نام مشتری یا نتیجه‌ی بی‌مجوز نیامده. اما هیچ نمونه‌ی مرتبط یا خروجی آزمون قابل بررسی ضمیمه نیست و توان اجرا عملاً بی‌شاهد است.",
      "fix": "خروجی آزمون داخلی روی داده‌ی ساختگی را ضمیمه کنید یا نمونه‌ای با مجوز انتشار بیاورید.",
      "limited_by_input": true,
      "gap_refs": ["G-07"]
    },
    {
      "id": "R09",
      "score": 3,
      "evidence": [
        {"section": "S02", "quote": "هدف: کاهش زمان بازبینی و کاهش پاسخ‌های نیازمند اصلاح [C-05]."}
      ],
      "reason": "لحن صادق و بدون وعده است، واژه‌ی ممنوع برند دیده نشد و عددی بدون منبع نیامده و ساختار بخش‌ها منظم است. جدول‌ها پر از نشانگر نامعلوم و ارجاع U و C است که خواندن را برای مدیر سنگین می‌کند.",
      "fix": "در متن اصلی ارجاع‌های U و C را کم کنید و نامعلوم‌های تکراری را به جدول U-ها بسپارید.",
      "limited_by_input": false,
      "gap_refs": []
    },
    {
      "id": "R10",
      "score": 3,
      "evidence": [
        {"section": "S15", "quote": "گام بعد: مدیر فروش تا پایان ماه درباره‌ی شروع پایلوت تصمیم می‌گیرد [C-13]"},
        {"section": "S15", "quote": "مرز تأیید و شروع: تأیید دامنه به معنی امضا یا شروع کار نیست."}
      ],
      "reason": "تصمیم، مسئول، پیش‌شرط‌ها و مرز تأیید و امضا و شروع روشن است و CTA با فهرست برند می‌خواند. تاریخ دقیق موعد نامعلوم است. متن سند دستور تزریقی G-11 را اجرا یا بازتولید نکرده است.",
      "fix": "تاریخ دقیق «پایان ماه» را (U-24) بنویسید.",
      "limited_by_input": false,
      "gap_refs": []
    }
  ],
  "bottom_line": "ساختار و صداقت ادعا خوب است، اما بخش‌های قیمت، زمان‌بندی و امنیت عملاً خالی‌اند و سند هنوز چیزی نیست که مشتری بتواند امضا یا مقایسه کند.",
  "biggest_weakness": {
    "criterion": "R06",
    "what": "هیچ مبلغ، مبنای قیمت، واحد یا نقطه‌ی پرداختی وجود ندارد و جمع‌ها نامعلوم‌اند.",
    "why": "مدیر فروش بدون هزینه نمی‌تواند تصمیم شروع بگیرد و ردیف قیمت زیر آستانه‌ی دروازه می‌ماند.",
    "fix": "بازه‌ی بودجه یا مبنای محاسبه را با مدیر فروش تعیین و نقاط پرداخت را به پذیرش D-01 تا D-03 وصل کنید."
  },
  "would_change": "یک برآورد قیمت تأییدشده‌ی مالک همراه با مدت هر مرحله، ظرفیت بازبین و مسئول داده‌ی تعیین‌شده نمره‌ی قیمت، زمان‌بندی و امنیت را بالا می‌برد."
}
